{
  "schema_version": "1.0",
  "prediction_id": "valorant-vct-2026-07-23-pac-cn-emea",
  "stage": "final",
  "generated_at": "2026-07-23T13:23:17+08:00",
  "model": "current-session-gpt-5",
  "reasoning_effort": null,
  "accepted_findings": [
    "f1",
    "f3",
    "f4"
  ],
  "rejected_findings": [
    "f2"
  ],
  "finding_adjudications": [
    {
      "finding_id": "f1",
      "decision": "accept",
      "rationale": "daily-summary 模式依 Valorant 輸出模板必須含涵蓋全部六場的決策總結表；主預測確實尚未提供。",
      "resulting_action": "在 presentation.summary_table 新增九欄、六列的今日 Valorant 賽事決策總結表；由 exporter 保證它是全文最後一個區塊。"
    },
    {
      "finding_id": "f2",
      "decision": "reject",
      "rationale": "紅隊誤用未加權平均。共用方法契約明定權重為完整度25%、新鮮度20%、名單25%、制度樣本20%、穩定性10%；84、96、83、68、62 的加權值為 80.75%，四捨五入正是 81%。六場個別信心度亦逐一符合此公式。",
      "resulting_action": "不更動任何信心度數值；在模型校準段新增公式與算術核對，避免讀者誤解。"
    },
    {
      "finding_id": "f3",
      "decision": "accept",
      "rationale": "正式逐圖表與 veto 已使用雙語名稱，但部分數據矩陣與敘事仍只寫英文簡稱，未完全符合統一標註規則。",
      "resulting_action": "將所有分析段落內的七張地圖統一為英文名稱（中國國服譯名）。"
    },
    {
      "finding_id": "f4",
      "decision": "accept",
      "rationale": "現有證據只能確認賽前頁與前一場實際五人有差異，以及 Spear 將首秀；沒有官方當場五人與角色分工公告。",
      "resulting_action": "保留 pre-lineup 限制、T1/VARREL 情境帶與 EF 換人折價，不憑空確認名單；正式公告後必須建立新版快照重算。"
    }
  ],
  "question_resolutions": [
    {
      "question": "Will stax or DH start for T1, and will Klaus or Foxy9 start for VARREL in their match?",
      "status": "unresolved",
      "response": "截至預測快照沒有可追溯的官方當場五人公告；賽前頁與上一場實際陣容不一致，不能替任一組合下定論。",
      "impact": "T1 62% 是兩種五人情境的混合估計；DH 延續且 Foxy9 缺席可使 T1 約上修 2–3 個百分點，反向組合則約降至 58–59%，正式名單後重算。"
    },
    {
      "question": "How will Spear's VCT debut on Eternal Fire impact team communication and role allocations against Team Heretics?",
      "status": "unresolved",
      "response": "只有換人與首秀事實，沒有 Spear 與四名隊友的 Tier 1 同陣容樣本或正式特務分配。",
      "impact": "已把 EF/TH 的制度樣本相關性與模型穩定性降至 45/50，維持 TH 57%；若 EF 無須重配 Controller/Initiator 且 Spear 首殺順利，對局可回到近五五開。"
    },
    {
      "question": "How will the Summit（天樞雲闕） permaban collision resolve in official vetoes for TYLOO vs Nova Esports and FPX vs EDward Gaming?",
      "status": "unresolved",
      "response": "pre-veto 證據不足以確認誰改變慣例。主情境是假設 TYLOO 先禁 Summit（天樞雲闕）、NOVA 攬下針對 Sunset（日落之城）的責任；另一場則由 EDG 禁 Summit（天樞雲闕）。",
      "impact": "若 NOVA 仍禁 Haven（隱世修所），TYLOO 可翻成 52–54% 小幅優勢；若 EDG 放 Summit（天樞雲闕）改禁 Sunset（日落之城），FPX 54% 的 veto 優勢需下修並重建分布。"
    },
    {
      "question": "What will be the official map pick/ban orders, side selections, and pistol/eco conversion rates across all six matches once vetoes conclude?",
      "status": "unresolved",
      "response": "六場均尚未完成正式 veto；現有來源也沒有一致口徑的 pistol/eco 與選邊資料。",
      "impact": "現階段只發布 pre-veto 主分布與價格門檻，不給注碼；正式 veto、選邊與可核對數據出現後建立 post-veto 快照。"
    }
  ],
  "changes": [
    {
      "path": "presentation.summary_table",
      "before": "缺少 daily-summary 決策表",
      "after": "新增六場、九欄決策總結表",
      "reason": "符合 Valorant daily-summary 輸出契約，並讓每場的比分、勝率、至少一圖、門檻、信心與風險可快速核對。",
      "finding_ids": [
        "f1"
      ]
    },
    {
      "path": "presentation.analysis_sections[*].markdown",
      "before": "部分敘事只使用英文地圖簡稱",
      "after": "所有地圖引用均採英文名稱（中國國服譯名）",
      "reason": "統一地圖命名格式。",
      "finding_ids": [
        "f3"
      ]
    },
    {
      "path": "presentation.analysis_sections[7].markdown",
      "before": "列出信心度組成但未展開加權算式",
      "after": "補上 80.75% 四捨五入為 81% 的完整加權算式",
      "reason": "駁回紅隊未加權平均算法，同時提升算術可稽核性。",
      "finding_ids": [
        "f2"
      ]
    },
    {
      "path": "risks / missing_data",
      "before": "已標示五人、首秀與 veto 未確認",
      "after": "保留限制並在裁決中明定公告後重算，不臆測未公布資訊",
      "reason": "名單與角色不確定性是真實限制，但目前不足以改寫鎖定分布。",
      "finding_ids": [
        "f4"
      ]
    }
  ],
  "thesis": "六場皆為 pre-veto BO3。市場盲模型依同 Patch 地圖內容、陣容確定度與 veto 路徑，依序傾向 Global Esports 53%、T1 62%、Nova Esports 54%、FunPlus Phoenix 54%、Team Heretics 57%、Natus Vincere 55%；其中 T1 的優勢最大，但 T1/VARREL 當場五人未確認，TYLOO/NOVA 與 FPX/EDG 則接近五五開。",
  "probability_groups": [
    {
      "id": "ge_fs_winner",
      "label": "GE vs FS 系列賽勝負",
      "outcomes": [
        {
          "key": "ge_win",
          "label": "Global Esports 勝",
          "probability": 53.0
        },
        {
          "key": "fs_win",
          "label": "FULL SENSE 勝",
          "probability": 47.0
        }
      ]
    },
    {
      "id": "ge_fs_score",
      "label": "GE vs FS 精確比分",
      "outcomes": [
        {
          "key": "ge_2_0",
          "label": "GE 2-0",
          "probability": 22.0
        },
        {
          "key": "ge_2_1",
          "label": "GE 2-1",
          "probability": 31.0
        },
        {
          "key": "fs_2_1",
          "label": "FS 2-1",
          "probability": 27.0
        },
        {
          "key": "fs_2_0",
          "label": "FS 2-0",
          "probability": 20.0
        }
      ]
    },
    {
      "id": "t1_varrel_winner",
      "label": "T1 vs VARREL 系列賽勝負",
      "outcomes": [
        {
          "key": "t1_win",
          "label": "T1 勝",
          "probability": 62.0
        },
        {
          "key": "varrel_win",
          "label": "VARREL 勝",
          "probability": 38.0
        }
      ]
    },
    {
      "id": "t1_varrel_score",
      "label": "T1 vs VARREL 精確比分",
      "outcomes": [
        {
          "key": "t1_2_0",
          "label": "T1 2-0",
          "probability": 29.0
        },
        {
          "key": "t1_2_1",
          "label": "T1 2-1",
          "probability": 33.0
        },
        {
          "key": "varrel_2_1",
          "label": "VARREL 2-1",
          "probability": 24.0
        },
        {
          "key": "varrel_2_0",
          "label": "VARREL 2-0",
          "probability": 14.0
        }
      ]
    },
    {
      "id": "tyloo_nova_winner",
      "label": "TYLOO vs NOVA 系列賽勝負",
      "outcomes": [
        {
          "key": "tyloo_win",
          "label": "TYLOO 勝",
          "probability": 46.0
        },
        {
          "key": "nova_win",
          "label": "NOVA 勝",
          "probability": 54.0
        }
      ]
    },
    {
      "id": "tyloo_nova_score",
      "label": "TYLOO vs NOVA 精確比分",
      "outcomes": [
        {
          "key": "tyloo_2_0",
          "label": "TYLOO 2-0",
          "probability": 15.0
        },
        {
          "key": "tyloo_2_1",
          "label": "TYLOO 2-1",
          "probability": 31.0
        },
        {
          "key": "nova_2_1",
          "label": "NOVA 2-1",
          "probability": 38.0
        },
        {
          "key": "nova_2_0",
          "label": "NOVA 2-0",
          "probability": 16.0
        }
      ]
    },
    {
      "id": "fpx_edg_winner",
      "label": "FPX vs EDG 系列賽勝負",
      "outcomes": [
        {
          "key": "fpx_win",
          "label": "FPX 勝",
          "probability": 54.0
        },
        {
          "key": "edg_win",
          "label": "EDG 勝",
          "probability": 46.0
        }
      ]
    },
    {
      "id": "fpx_edg_score",
      "label": "FPX vs EDG 精確比分",
      "outcomes": [
        {
          "key": "fpx_2_0",
          "label": "FPX 2-0",
          "probability": 19.0
        },
        {
          "key": "fpx_2_1",
          "label": "FPX 2-1",
          "probability": 35.0
        },
        {
          "key": "edg_2_1",
          "label": "EDG 2-1",
          "probability": 29.0
        },
        {
          "key": "edg_2_0",
          "label": "EDG 2-0",
          "probability": 17.0
        }
      ]
    },
    {
      "id": "ef_th_winner",
      "label": "EF vs TH 系列賽勝負",
      "outcomes": [
        {
          "key": "ef_win",
          "label": "Eternal Fire 勝",
          "probability": 43.0
        },
        {
          "key": "th_win",
          "label": "Team Heretics 勝",
          "probability": 57.0
        }
      ]
    },
    {
      "id": "ef_th_score",
      "label": "EF vs TH 精確比分",
      "outcomes": [
        {
          "key": "ef_2_0",
          "label": "EF 2-0",
          "probability": 16.0
        },
        {
          "key": "ef_2_1",
          "label": "EF 2-1",
          "probability": 27.0
        },
        {
          "key": "th_2_1",
          "label": "TH 2-1",
          "probability": 33.0
        },
        {
          "key": "th_2_0",
          "label": "TH 2-0",
          "probability": 24.0
        }
      ]
    },
    {
      "id": "m8_navi_winner",
      "label": "M8 vs NAVI 系列賽勝負",
      "outcomes": [
        {
          "key": "m8_win",
          "label": "Gentle Mates 勝",
          "probability": 45.0
        },
        {
          "key": "navi_win",
          "label": "NAVI 勝",
          "probability": 55.0
        }
      ]
    },
    {
      "id": "m8_navi_score",
      "label": "M8 vs NAVI 精確比分",
      "outcomes": [
        {
          "key": "m8_2_0",
          "label": "M8 2-0",
          "probability": 16.0
        },
        {
          "key": "m8_2_1",
          "label": "M8 2-1",
          "probability": 29.0
        },
        {
          "key": "navi_2_1",
          "label": "NAVI 2-1",
          "probability": 34.0
        },
        {
          "key": "navi_2_0",
          "label": "NAVI 2-0",
          "probability": 21.0
        }
      ]
    }
  ],
  "confidence": {
    "value": 81,
    "rationale": "賽程、賽制、Patch、七圖池與同賽事結果新鮮且可交叉查核；CN 兩場同 Patch 樣本最完整。扣分來自六場均未公布 veto、T1/VARREL 五人不確定、EF 當日換人與 Summit 小樣本。",
    "components": {
      "data_completeness": 84,
      "freshness": 96,
      "lineup_certainty": 83,
      "regime_relevance": 68,
      "model_stability": 62
    }
  },
  "key_factors": [
    {
      "evidence_ids": [
        "ge-current",
        "fs-current"
      ],
      "impact": "mixed",
      "reason": "GE 2-0 內容較乾淨，FS 有 Ascent/ Split 取圖路徑但 Haven 下限很低。"
    },
    {
      "evidence_ids": [
        "t1-current",
        "varrel-current",
        "t1-varrel-rosters"
      ],
      "impact": "positive",
      "reason": "T1 對手含金量與三張地圖路徑較優，但最終五人未確認限制上修。"
    },
    {
      "evidence_ids": [